{
  "schema_version": "1.0",
  "event_id": "evt-cam01-20261016T065000Z-0001",
  "id": "inc_cam_01_12500",
  "camera_id": "cam_01",
  "camera_name": "Central Plaza - North",
  "location": { "lat": 12.9716, "lng": 77.5946, "label": "Central Plaza" },
  "type": "fall_collapse",
  "confidence": 0.93,
  "severity": "high",
  "severity_verified": true,
  "timestamp": "2026-10-16T06:50:00Z",
  "status": "new",
  "snapshot_url": "/media/snapshots/inc_cam_01_12500.jpg",
  "clip_url": "/media/clips/inc_cam_01_12500.mp4",
  "notes": "Temporal fall detector confirmed the event.",
  "verification": { "window_seconds": 2.5, "frames_confirmed": 36, "frames_required": 25 },
  "source": "ai_detection",
  "priority": "high",
  "workflow_status": "queued",
  "workflow_updated_at": "2026-10-16T06:50:00Z",
  "notification_status": "pending",
  "notification_attempts": 0,
  "notification_sent_at": null,
  "acknowledged_at": null,
  "escalated_at": null,
  "resolved_at": null,
  "responder_id": null,
  "detection_metadata": { "detector": "fall_detector", "track_count": 1 }
}
